{
  "$schema": "http://json-schema.org/draft-07/schema#",
  "$id": "https://spoke42.invalid/schemas/connect/connect-invoke-request.schema.json",
  "title": "ConnectInvokeRequest",
  "description": "Remote op call wrapping an existing ops request envelope as opaque JSON.",
  "type": "object",
  "required": [
    "session_id",
    "sequence",
    "request_id",
    "op",
    "payload",
    "signature",
    "extensions"
  ],
  "properties": {
    "session_id": {
      "type": "string",
      "minLength": 1,
      "description": "Opaque session id."
    },
    "sequence": {
      "type": "integer",
      "minimum": 0,
      "maximum": 9007199254740991,
      "description": "Monotonic per-session outbound from this sender; logical u64 capped at 2^53-1 (JSON-safe)."
    },
    "request_id": {
      "type": "string",
      "minLength": 1,
      "description": "Caller-generated correlation id (UUID recommended)."
    },
    "op": {
      "type": "string",
      "minLength": 1,
      "description": "Open vocabulary. Core (documented, not enforced): upsert, promote, relate, check, assemble, project, compute, extract."
    },
    "payload": {
      "$ref": "https://spoke42.invalid/schemas/common/common.schema.json#/definitions/OpaqueJson",
      "description": "Opaque JSON — MUST be a full existing ops request envelope for the named op when targeting SPOKE ops."
    },
    "auth": {
      "$ref": "https://spoke42.invalid/schemas/common/common.schema.json#/definitions/OpaqueJson",
      "description": "Optional mid-session proof blob; primary auth is hello. Shape method-specific when used."
    },
    "signature": {
      "type": "string",
      "minLength": 86,
      "maxLength": 86,
      "description": "base64url (no padding) of the 64-byte Ed25519 signature over the RFC 8785 JCS canonicalized signed object (spoke-connect-invoke-request-jcs-v1)."
    },
    "extensions": {
      "$ref": "https://spoke42.invalid/schemas/common/common.schema.json#/definitions/ExtensionMap",
      "description": "Product namespace bag."
    }
  },
  "additionalProperties": false
}
